{
  "schema": "intrmotiv/study/v1",
  "workflow_version": "1.12.0",
  "study_id": "fixed_reward_manager_diagnostic_20260924",
  "description": "One short waypoint learner diagnostic for reward-manager option-state attribution.",
  "expected_runs": 1,
  "metadata": {
    "project": "SF_IntrMotiv_FixedRewardDGPeakTransfer",
    "training_steps": 131072,
    "reward_cue": "source transparent goal",
    "reward_value": 10,
    "source_revalidation_required": true
  },
  "training": {
    "mode": "sample_factory",
    "batch_name": "fixed_reward_manager_diagnostic_20260924",
    "workspace_root": "/work/classic/fr_xl1014-fixed-reward-transfer",
    "output_root": "/work/classic/fr_xl1014-fixed-reward-transfer/IntrMotiv/SF_hipposlam/train_dir/fixed_reward_dg_peak_transfer_qualification_20260924",
    "run_name_template": "QMD2_{base_label}_{arm_label}_S{seed}",
    "condition_name_template": "QMD2_{base_label}_{arm_label}",
    "seed_arg": "--seed={seed}",
    "common_args": [
      "--DG_BN_intercept=2.43",
      "--DG_name=batchnorm_relu",
      "--Hippo_L=64",
      "--Hippo_R=8",
      "--Hippo_n_feature=64",
      "--actor_critic_share_weights=True",
      "--advantage_reward_source=external",
      "--algo=APPO",
      "--batch_size=2048",
      "--benchmark=False",
      "--ca3_predictor_shadow=False",
      "--checkpoint_frame_targets=65536,131072",
      "--core_name=BypassSS",
      "--decorrelate_experience_max_seconds=120",
      "--depth_sensor=True",
      "--dg_ca3_temporal_exclusion_coeff=0.0",
      "--dg_global_punishment_coeff=0.0",
      "--dg_global_punishment_temperature=0.5",
      "--dg_orthogonal_recruitment=False",
      "--dg_orthogonal_recruitment_max_per_rollout=0",
      "--dg_path_scatter_coeff=0.0",
      "--dg_row_repulsion_coeff=0.0",
      "--distance_learning=True",
      "--dmlab_extended_action_set=False",
      "--dmlab_level_cache_path=/work/classic/fr_xl1014-fixed-reward-transfer/IntrMotiv/SF_hipposlam/runtime/dmlab_cache",
      "--dmlab_navigation_action_set=True",
      "--dmlab_one_task_per_worker=True",
      "--dmlab_reduced_action_set=False",
      "--dmlab_renderer=software",
      "--dmlab_runfiles_path=/work/classic/fr_xl1014-fixed-reward-transfer/IntrMotiv/SF_hipposlam/runtime/fixed_reward_transfer_runfiles",
      "--dmlab_use_level_cache=True",
      "--double_value=False",
      "--encoder_batch_loss=False",
      "--encoder_batch_loss_temperature=0.5",
      "--encoder_collision_loss_coeff=0.0",
      "--encoder_conv_architecture=layer2_resnet18",
      "--encoder_density_loss_coeff=0.0",
      "--encoder_grad_coeff=1",
      "--encoder_multi_activation_loss=False",
      "--encoder_population_usage_loss=False",
      "--encoder_reward_method=encourage",
      "--encoder_reward_recipient=arrival",
      "--encoder_reward_require_local_predecessor=True",
      "--encoder_unused_sequence_loss=False",
      "--env_frameskip=4",
      "--exploration_coverage_grid_size=100",
      "--exploration_coverage_telemetry=True",
      "--exploration_loss_coeff=0.005",
      "--exploration_window_steps=10000",
      "--extra_decoder_loss=False",
      "--extra_encoder_losses=False",
      "--force_envs_single_thread=True",
      "--gamma=0.99",
      "--hrl_action_path_integration=False",
      "--hrl_behavior_mode_condition=False",
      "--hrl_bootstrap_horizon=64",
      "--hrl_distance_bonus_coeff=0.1",
      "--hrl_edge_confidence_threshold=0.5",
      "--hrl_edge_reliability_threshold=0.5",
      "--hrl_empirical_her=False",
      "--hrl_empirical_her_coeff=0.0",
      "--hrl_empirical_her_horizon=64",
      "--hrl_exploration_horizon=64",
      "--hrl_exploration_mode=False",
      "--hrl_exploration_policy=shared",
      "--hrl_fast_weight_half_life_options=5000",
      "--hrl_frontier_uncertainty_weight=1.0",
      "--hrl_goal_conditioning=target_id_film",
      "--hrl_graph_memory=policy_buffer",
      "--hrl_landmark_geometry=none",
      "--hrl_manager_exploration_probability=0.0",
      "--hrl_min_target_visits=1",
      "--hrl_motion_policy_input=False",
      "--hrl_passive_edge_confidence_threshold=2",
      "--hrl_passive_max_path_length=64",
      "--hrl_passive_min_displacement=2",
      "--hrl_persistent_fast_weights=False",
      "--hrl_target_hit_reward=1.0",
      "--hrl_target_timing=immediate",
      "--hrl_timeout_margin_ratio=0.20",
      "--hrl_timeout_margin_steps=2",
      "--hrl_worker_reward_mode=hit_distance",
      "--iterative_update=False",
      "--keep_checkpoints=8",
      "--learning_rate=0.0002",
      "--masked_distance_matrix=False",
      "--max_grad_norm=0.0",
      "--max_policy_lag=35",
      "--metric=sum",
      "--nonlinearity=relu",
      "--normalize_advantage=True",
      "--normalize_input=False",
      "--num_batches_per_epoch=2",
      "--num_envs_per_worker=2",
      "--num_epochs=1",
      "--num_policies=1",
      "--num_workers=32",
      "--number_instruction_coef=9",
      "--online_spatial_output_root=/work/classic/fr_xl1014-fixed-reward-transfer/IntrMotiv/SF_hipposlam/train_dir/analysis/fixed_reward_dg_peak_transfer_qualification_20260924/online_spatial",
      "--online_spatial_snapshot_max_frames=131072",
      "--online_spatial_snapshot_targets=65536,131072",
      "--online_spatial_telemetry=False",
      "--online_spatial_workspace_root=/work/classic/fr_xl1014-fixed-reward-transfer",
      "--ppo_clip_ratio=0.25",
      "--rec_distances=True",
      "--recurrence=64",
      "--reset_critic=False",
      "--reset_decoder=False",
      "--reward_scale=0.1",
      "--rnn_size=0",
      "--rnn_type=gru",
      "--rollout=64",
      "--save_best_after=1200",
      "--save_best_every_sec=300",
      "--save_every_sec=300",
      "--save_initial_checkpoint=True",
      "--save_milestones_sec=1800",
      "--set_workers_cpu_affinity=True",
      "--train_for_env_steps=131072",
      "--use_external=True",
      "--use_internal=False",
      "--use_record_episode_statistics=True",
      "--use_rnn=True",
      "--value_loss_coeff=0.3",
      "--wandb_dir=/work/classic/fr_xl1014-fixed-reward-transfer/IntrMotiv/SF_hipposlam/train_dir/fixed_reward_dg_peak_transfer_qualification_20260924/wandb",
      "--wandb_group=fixed_reward_manager_diagnostic_20260924",
      "--wandb_project=SF_IntrMotiv_FixedRewardDGPeakTransfer",
      "--wandb_user=xiaoxionglin-bernstein-center-freiburg",
      "--with_number_instruction=True",
      "--with_pbt=False",
      "--with_pos_obs=False",
      "--with_vtrace=False",
      "--with_wandb=True",
      "--worker_num_splits=2"
    ]
  },
  "bases": [
    {
      "name": "dg50",
      "label": "D50",
      "args": [
        "--device=cpu",
        "--dg_goal_input=write",
        "--env=openfield_map2_fixed_reward_dg50",
        "--save_best_metric=z_00_openfield_map2_fixed_reward_dg50_lenweighted_score"
      ],
      "metadata": {
        "site": "dg50",
        "source": "00_DGC_WAYPOINT_DG_F64_S123",
        "source_checkpoint": "/work/classic/fr_xl1014-fixed-reward-transfer/IntrMotiv/SF_hipposlam/train_dir/analysis/fixed_reward_transfer_20260924/source_checkpoints/dg50/00_DGC_WAYPOINT_DG_F64_S123/checkpoint_p0/checkpoint_000015950_130662400.pth",
        "source_sha256": "6951c12faecda21848bd73a3422ffe1928dd2dc07a515ef1b8b9720efc2cc3c0",
        "target_id": 50,
        "reward_cell": "(300,400)x(1900,2000)"
      }
    }
  ],
  "factors": [
    {
      "name": "arm",
      "levels": [
        {
          "value": "W_FIXED",
          "label": "W_FIXED",
          "args": [
            "--transfer_scope=policy",
            "--transfer_freeze_dg=true",
            "--transfer_freeze_worker=true",
            "--fixed_task_conditioning=false",
            "--fixed_task_goal_mixture=false",
            "--fixed_task_target_id={base_target_id}",
            "--hrl_controllable_graph=true",
            "--hrl_direct_target_selection=reward_value",
            "--ppo_dg_gradient=stop",
            "--transfer_model_path={base_source_checkpoint}",
            "--hrl_manager_mode=frontier_waypoint",
            "--hrl_edge_exploration=True"
          ],
          "metadata": {
            "architecture": "waypoint",
            "scope": "policy",
            "dg_trainable": false
          }
        }
      ]
    }
  ],
  "seeds": [
    42
  ],
  "analysis": {
    "step_tag": "train/env_steps",
    "terminal_width": 10000000,
    "max_workers": 4,
    "group_by": [
      "site",
      "arm"
    ],
    "contrast_group_by": [
      "site"
    ],
    "replicate_by": [
      "seed"
    ],
    "window_metrics": {
      "episode_return": "reward/reward"
    },
    "cumulative_metrics": {},
    "contrasts": []
  }
}
