{
  "schema": "intrmotiv/study/v1",
  "workflow_version": "1.8.0",
  "study_id": "intrmotiv_ddqn_sf_release_preflight_20260911",
  "description": "Final native SF adapter versus existing batched standalone runner: fixed 250k frames, seed99, v2 DDQN/HER learning budgets.",
  "expected_runs": 2,
  "metadata": {
    "stage": "sf_release_preflight",
    "parent_run": "DGC_DIRECT_WORKER_F16_S99",
    "parent_frames": 25001984,
    "parent_source_seed": 99,
    "representation": "frozen",
    "recognition": "exclusive",
    "action_set": "navigation8",
    "action_repeat": 4,
    "policy_pose_input": false,
    "graph_learning": false,
    "release_status": "gated",
    "comparison": "standalone_batched_vs_sf_async",
    "development_goals": "1,4,11",
    "child_schema": "intrmotiv/ddqn-worker/v2",
    "target_period_updates": 100,
    "accepted_decisions_per_update": 64,
    "valid_td_positions_per_update": 256,
    "her_horizon": 64
  },
  "training": {
    "mode": "sample_factory",
    "batch_name": "intrmotiv_ddqn_sf_release_preflight_20260911",
    "workspace_root": "/work/classic/fr_xl1014-train",
    "output_root": "/work/classic/fr_xl1014-train/IntrMotiv/SF_hipposlam/train_dir/intrmotiv_ddqn_sf_release_preflight_20260911",
    "run_name_template": "DQSFR_{execution_label}_S{seed}",
    "condition_name_template": "DQSFR_{execution_label}",
    "seed_arg": "--seed={seed}",
    "common_args": [
      "--env=openfield_map2_fixed_loc3_fixedlength_noreward",
      "--parent-manifest=06_experiments/data/intrmotiv_ddqn_her_20260911/parent_manifest.json",
      "--parent-run=DGC_DIRECT_WORKER_F16_S99",
      "--total-frames=250000",
      "--num-envs=32",
      "--device=cpu",
      "--torch-threads=8",
      "--registry=1,4,11",
      "--replay-capacity=200000",
      "--learning-start=16384",
      "--milestones=0,250000,500000,1000000,2500000,5000000",
      "--target-period=100",
      "--decisions-per-update=64",
      "--td-positions-per-update=256",
      "--learner-execution=batched"
    ]
  },
  "bases": [
    {
      "name": "DDQN_HER",
      "label": "DDQN_HER",
      "args": [
        "--her-fraction=0.8"
      ],
      "metadata": {
        "her": true
      }
    }
  ],
  "factors": [
    {
      "name": "execution",
      "levels": [
        {
          "value": "standalone",
          "label": "STANDALONE",
          "args": [
            "--execution-backend=standalone"
          ]
        },
        {
          "value": "sample_factory",
          "label": "SF",
          "args": [
            "--execution-backend=sample_factory",
            "--sf-async=true",
            "--sf-workers=16",
            "--sf-splits=2",
            "--sf-rollout=32",
            "--sf-batch-size=1024",
            "--sf-learner-threads=1"
          ]
        }
      ]
    }
  ],
  "seeds": [
    99
  ],
  "analysis": {
    "step_tag": "train/env_steps",
    "terminal_width": 125000,
    "synchronized_steps": [
      250000
    ],
    "max_workers": 2,
    "group_by": [
      "execution"
    ],
    "contrast_group_by": [],
    "replicate_by": [
      "seed"
    ],
    "window_metrics": {
      "throughput_fps": "ddqn/throughput_fps",
      "td_loss": "ddqn/td_loss",
      "realized_her_fraction": "ddqn/realized_her_fraction",
      "q_out_of_range_fraction": "ddqn/q_out_of_range_fraction"
    },
    "cumulative_metrics": {},
    "contrasts": []
  },
  "telemetry": {}
}
